timestamp,run_id,rank,market_title,side,consensus,consensus_count,average_edge,ai_probability,market_price,reasoning,link
2025-12-12T15:56:06.025838,20251212_155606,3,Spread: 76ers (-6.5),NO,3 out of 5 models agreed on NO (60%),3,-3.8%,43.4%,46.7%,"Embiid's 4-21 shooting performance and Pacers' momentum suggests 76ers covering 6.5 points is less likely than market price indicates, with Claude identifying 11.7% edge on NO.",https://polymarket.com/event/nba-ind-phi-2025-12-12
2025-12-12T15:56:06.025838,20251212_155606,4,"Maduro out by March 31, 2026? (Alternative view)",YES,1 out of 5 models (DeepSeek only),1,+19.0% (single model),80%,61.0%,"DeepSeek identifies significant edge based on intensified U.S. military pressure and international coordination for regime change timeline, though this is a contrarian position.",https://polymarket.com/event/maduro-out-in-2025
2025-12-12T15:56:06.025838,20251212_155606,5,Spread: 76ers (-6.5) (Alternative view),NO_TRADE,2 out of 5 models agreed (40%),2,+0.8%,47.5%,46.7%,"Minimal edge suggests market is efficiently priced given uncertainty around Embiid's form and spread magnitude, making this a pass despite some models favoring NO.",https://polymarket.com/event/nba-ind-phi-2025-12-12
2025-12-12T16:01:58.036358,20251212_160158,1,Will Trump sell 0 Gold Cards in 2025?,NO,"4 out of 5 models agreed (OpenAI, DeepSeek, Opus, Claude as NO_TRADE but leaning NO)",4,-39.3%,36.8%,87.0%,"Commerce Secretary Lutnick explicitly reported 1,000 Gold Cards sold in March 2025, making the ""zero sales"" outcome factually incorrect and creating massive mispricing.",https://polymarket.com/event/how-many-gold-cards-will-trump-sell-in-2025
2025-12-12T16:01:58.036358,20251212_160158,2,"Maduro out by March 31, 2026?","MIXED (2 YES, 2 NO, 1 NO_TRADE - NO CLEAR CONSENSUS)","2 out of 5 models said YES (DeepSeek, Claude)",2,+1.8%,57.5%,61.0%,"Split consensus with DeepSeek (80% YES) and Claude (75% YES) seeing escalating U.S. pressure and opposition momentum as underpriced, while Opus and OpenAI favor NO due to authoritarian resilience.",https://polymarket.com/event/maduro-out-in-2025
2025-12-12T16:01:58.036358,20251212_160158,3,Spread: 76ers (-6.5),NO_TRADE (majority),"3 out of 5 models said NO_TRADE, 1 YES (Gemini)",3,+5.4%,52.2%,46.7%,"Consensus views this as fairly priced with Embiid's inconsistency (4-of-21 shooting) offsetting home court advantage, creating no actionable edge despite slight model favoritism.",https://polymarket.com/event/nba-ind-phi-2025-12-12
2025-12-12T16:07:59.764353,20251212_160759,1,"Maduro out by March 31, 2026?",NO,3 out of 4 models agreed (OpenAI NO_TRADE but leaning NO),3,-16.5%,40%,61.0%,Market significantly overestimates regime change probability given Maduro's history of surviving pressure and Putin's recent reaffirmation of support.,https://polymarket.com/event/maduro-out-in-2025
2025-12-12T16:07:59.764353,20251212_160759,2,Will Trump sell 0 Gold Cards in 2025?,NO,4 out of 4 models agreed on NO,4,-20.8%,66.25%,87.0%,"Market severely overprices zero sales when reports indicate the program launched and generated revenue, even if underwhelming versus targets.",https://polymarket.com/event/how-many-gold-cards-will-trump-sell-in-2025
2025-12-12T16:07:59.764353,20251212_160759,3,Will Trump sell 0 Gold Cards in 2025? (Alternative view),YES (DeepSeek contrarian),1 out of 4 models (DeepSeek only),1,+11.0% (DeepSeek calculation),98% (DeepSeek),87.0%,"DeepSeek argues program faced ""significant challenges"" and year nearly over, making zero sales virtually certain.",https://polymarket.com/event/how-many-gold-cards-will-trump-sell-in-2025
2025-12-12T16:07:59.764353,20251212_160759,4,Spread: 76ers (-6.5),NO_TRADE,3 out of 4 models agreed (OpenAI dissented with NO),3,+2.7%,49.75%,46.7%,Embiid's poor shooting and Pacers' momentum make this essentially a coin flip with minimal edge.,https://polymarket.com/event/nba-ind-phi-2025-12-12
2025-12-12T16:07:59.764353,20251212_160759,5,Spread: 76ers (-6.5) (Alternative view),NO (OpenAI only),1 out of 4 models,1,-6.7% (OpenAI calculation),40% (OpenAI),46.7%,OpenAI sees 76ers inconsistency and Pacers momentum suggesting they keep it within the spread.,https://polymarket.com/event/nba-ind-phi-2025-12-12
2025-12-12T16:14:01.271100,20251212_161401,1,"Maduro out by March 31, 2026?",NO,"4 out of 5 models agreed (OpenAI NO_TRADE but leaning NO, Gemini no response, DeepSeek NO, Opus NO, Claude NO_TRADE but leaning NO)",4,-13.3%,46.25%,61.0%,"Market significantly overvalues regime change probability given Maduro's historical resilience, Russian backing, and authoritarian control despite recent sanctions pressure.",https://polymarket.com/event/maduro-out-in-2025
2025-12-12T16:14:01.271100,20251212_161401,2,Will Trump sell 0 Gold Cards in 2025?,YES,"2 out of 5 models agreed on YES (DeepSeek YES, Gemini no response), 2 on NO (OpenAI NO, Claude NO), 1 NO_TRADE (Opus)",2,-1.75% (mixed signals),82.25%,87.0%,"DeepSeek's 97% probability assessment suggests market underprices the near-certainty of zero sales given program's documented failure and minimal time remaining, though other models see value on NO side.",https://polymarket.com/event/how-many-gold-cards-will-trump-sell-in-2025
2025-12-12T16:14:01.271100,20251212_161401,3,Spread: 76ers (-6.5),NO_TRADE (but Gemini YES creates opportunity),"4 out of 5 models said NO_TRADE, 1 said YES (Gemini)",4,+5.7%,52%,46.7%,"Gemini's 62% probability and +15.3% edge on YES suggests potential value on 76ers covering despite Pacers' terrible road record, though most models see this as efficiently priced.",https://polymarket.com/event/nba-ind-phi-2025-12-12
2025-12-12T16:14:01.271100,20251212_161401,4,Will Trump sell 0 Gold Cards in 2025? (NO side),NO,"2 out of 5 models explicitly recommended NO (OpenAI, Claude)",2,+6.6% (for NO position),75% (inverse of YES),13.0% (NO side),"Claude and OpenAI identify 25% chance of at least one sale through desperation pricing or wealthy buyer, making NO at 13% market price potentially undervalued.",https://polymarket.com/event/how-many-gold-cards-will-trump-sell-in-2025
2025-12-12T16:14:01.271100,20251212_161401,5,"Maduro out by March 31, 2026? (NO_TRADE consensus but clear directional edge)",NO_TRADE (with strong NO lean),5 out of 5 models leaned toward lower probability than market,5,-13.3%,46.25%,61.0%,"Universal consensus that market overestimates regime change probability, with Opus showing strongest conviction at -26% edge despite NO_TRADE recommendations from some models.",https://polymarket.com/event/maduro-out-in-2025
2025-12-12T16:19:54.777331,20251212_161954,1,FC Bayern München vs. 1. FSV Mainz 05: O/U 3.5,YES (Over 3.5 goals),3 out of 4 models agreed (OpenAI NO_TRADE but leaning YES at 65%),3,+13.7%,73.75%,63.0%,Bayern's historic 21-game streak of scoring 2+ goals combined with Mainz's weak away defense creates strong value on the over.,https://polymarket.com/event/bun-bay-mai-2025-12-14-more-markets
2025-12-12T16:19:54.777331,20251212_161954,2,US bank failure by March 31?,NO (betting against bank failure),4 out of 4 models agreed on NO_TRADE/NO direction,4,-55.0% (massive mispricing favoring NO),23.75%,78.0%,"No systemic stress indicators and strong regulatory oversight suggest the 78% YES price dramatically overvalues failure probability, though data discrepancy concerns warrant caution.",https://polymarket.com/event/us-bank-failure-by-march-31-294
2025-12-12T16:19:54.777331,20251212_161954,3,Dota 2: Team Spirit vs Team Liquid - Game 2 Winner,NO (betting on Team Spirit),3 out of 4 models agreed on NO_TRADE but favoring Spirit,3,-8.8% (slight edge toward Spirit),53.75%,62.2%,"Team Spirit's historical edge (14-10 overall, recent 1-0 win) suggests Liquid is slightly overpriced, but edge is marginal and below actionable threshold.",https://polymarket.com/event/dota2-ts8-liquid-2025-12-12
2025-12-12T16:25:44.961484,20251212_162544,1,Thailand x Cambodia ceasefire by December 15?,NO,5 out of 5 models agreed,5,-35.3%,52%,96.6%,"With active border clashes as of December 7, Thailand's parliament dissolved December 11, and only 3 days until deadline, a ceasefire is extremely unlikely despite market pricing it at near-certainty.",https://polymarket.com/event/thailand-x-cambodia-ceasefire-by-december-15
2025-12-12T16:25:44.961484,20251212_162544,2,Dota 2: GamerLegion vs 1win - Game 2 Winner,NO,3 out of 5 models agreed (2 NO_TRADE),3,-10.0%,63.3%,90.0%,GamerLegion's poor recent form (2-8 in last matches) versus 1win's stronger performance (5-8) and favorable betting odds suggest the market significantly overvalues GamerLegion.,https://polymarket.com/event/dota2-gl-1win-2025-12-12
2025-12-12T16:25:44.961484,20251212_162544,3,Dota 2: Team Falcons vs PARIVISION - Game 1 Winner,NO,3 out of 5 models agreed (2 NO_TRADE),3,-9.3%,32.8%,37.0%,"Team Falcons' strong recent form and series victory (2-1) suggests they are underpriced, with PARIVISION's 37% market price appearing slightly inflated despite competitive head-to-head history.",https://polymarket.com/event/dota2-flc-pari-2025-12-12
2025-12-12T16:31:42.296516,20251212_163142,1,Will Jesus Christ return before GTA VI?,NO,4 out of 4 models agreed,4,-50.0%,1.0%,51.0%,"GTA VI has a confirmed November 2026 release date while the Second Coming has zero empirical basis for prediction, making this a 50% mispricing opportunity.",https://polymarket.com/event/what-will-happen-before-gta-vi
2025-12-12T16:31:42.296516,20251212_163142,2,Will Villarreal CF win on 2025-12-14?,YES,4 out of 4 models agreed,4,+14.3%,72.3%,58.0%,Third-place LaLiga team Villarreal facing last-place Levante represents a classic top-vs-bottom mismatch that the market is significantly undervaluing.,https://polymarket.com/event/lal-lev-vil-2025-12-14
2025-12-12T16:31:42.296516,20251212_163142,3,Kraken vs. Utah: O/U 5.5,NO_TRADE (but slight Over lean),4 out of 4 models agreed on NO_TRADE,4,+4.5%,53.5%,52.0%,"Seattle's momentum from breaking their losing streak and Utah's defensive struggles suggest slight Over value, but edge is below actionable threshold.",https://polymarket.com/event/nhl-sea-utah-2025-12-13
2025-12-12T16:37:34.920383,20251212_163734,1,"Will ""Avatar: Fire and Ash"" Opening Weekend Box Office be between 90m and 101m?",NO,4 out of 4 models agreed,4,-38.8%,22.5%,60.7%,"Industry tracking projects $100M-$130M opening, making it highly likely to exceed the narrow $90M-$101M range, yet market prices this at 60.7%.",https://polymarket.com/event/avatar-fire-and-ash-opening-weekend-box-office
2025-12-12T16:37:34.920383,20251212_163734,2,Will Trump meet with Changpeng Zhao in 2025?,NO,3 out of 4 models agreed on NO,3,-39.5%,33.3%,96.2%,"Despite the pardon, there's no public information about a planned meeting with only weeks left in 2025, making 96.2% probability significantly overconfident.",https://polymarket.com/event/who-will-trump-meet-with-in-2025
2025-12-12T16:37:34.920383,20251212_163734,3,Bulls vs. Hornets: 1H O/U 113.5,NO_TRADE,4 out of 5 models agreed on NO_TRADE,4,-0.8%,48.4%,48.0%,"Market is efficiently priced with minimal edge despite both teams' defensive struggles, offering insufficient value for a trade.",https://polymarket.com/event/nba-chi-cha-2025-12-12
2025-12-12T16:43:30.369576,20251212_164330,1,Will 'Clair Obscur: Expedition 33' win Game of the Year in the 2025 Steam Awards?,YES,"3 out of 4 models agreed (OpenAI NO_TRADE but leaning YES at 85%, DeepSeek YES, Gemini YES, Opus NO_TRADE but 85%, Claude identified data issue)",3,+8.5%,73.6% (excluding Claude's 5% outlier due to data concerns),81.3%,"Game reportedly won The Game Awards 2025 GOTY creating massive momentum for Steam Awards, though Claude flags potential data quality issues requiring verification.",https://polymarket.com/event/steam-awards-game-of-the-year-395
2025-12-12T16:43:30.369576,20251212_164330,2,Pacers vs. 76ers: O/U 225.5,YES (UNDER),4 out of 4 models agreed on UNDER,4,+12.4%,57.8% for UNDER (42.2% for OVER),52.0% (for OVER),"Both teams showing elite defensive trends (Pacers 5 of 7 under, 76ers 4 straight under) with poor offensive ratings creating strong statistical case for under 225.5.",https://polymarket.com/event/nba-ind-phi-2025-12-12
2025-12-12T16:43:30.369576,20251212_164330,3,Lightning vs. Islanders,NO (bet Islanders),"2 out of 4 models agreed on NO (Opus NO, Claude NO_TRADE with 50/50)",2,+5.3% (for Islanders),45.3% for Lightning,54.0% (for Lightning),"Islanders just shut out Lightning 2-0 with dominant Sorokin performance and home ice advantage, though Horvat injury creates some uncertainty.",https://polymarket.com/event/nhl-tb-nyi-2025-12-13
2025-12-12T16:49:26.225059,20251212_164926,1,"Will Elon Musk post 240-259 tweets from December 9 to December 16, 2025?",NO,5 out of 5 models agreed (100%),5,-85.7%,7.6%,97.9%,"Massive mispricing as the broader Polymarket distribution shows this range has only 12% probability, yet this binary market prices it at 97.9% - likely a data error or market about to resolve.",https://polymarket.com/event/elon-musk-of-tweets-december-9-december-16
2025-12-12T16:49:26.225059,20251212_164926,2,Another 7.0 or above earthquake by December 15?,NO_TRADE (mixed signals),"3 out of 5 models said NO_TRADE, 1 YES, 1 NO",3,-12.0%,75.5%,89.3%,"Models split between high probability (85-95%) and low probability (30%), with insufficient consensus edge despite recent Japan seismic activity and megaquake advisory.",https://polymarket.com/event/another-7pt0-or-above-earthquake-by-548
2025-12-12T16:49:26.225059,20251212_164926,3,Will the Fed decrease interest rates by 50+ bps after the March 2026 meeting?,NO_TRADE,4 out of 5 models agreed on NO_TRADE,4,-4.8%,3.5%,8.0%,"Fed guidance projects only one 25bps cut in 2026, making 50+ bps extremely unlikely, but market already prices this low at 8% with insufficient edge for trade.",https://polymarket.com/event/fed-decision-in-march-885
2025-12-12T16:55:20.436624,20251212_165520,1,"Will Trump establish a Gaza ""Board of Peace"" in 2025?",NO,4 out of 5 models agreed (OpenAI NO_TRADE but leaning NO),4,-29.8%,71.25%,96.0%,"Critical distinction between announcing plans (done) versus actually establishing the board in 2025 with only ~19 days remaining and Trump stating members named ""early next year.""",https://polymarket.com/event/will-trump-establish-a-gaza-board-of-peace-in-2025
2025-12-12T16:55:20.436624,20251212_165520,2,Barcelona vs. Olympiacos B.C.,YES,3 out of 5 models agreed (1 NO_TRADE),3,+11.3%,64.3%,54.3%,Barcelona's exceptional recent form under new coach (7 wins in 8 games) combined with home court advantage is significantly undervalued by the market.,https://polymarket.com/event/euroleague-barcelon-olympiac-2025-12-12
2025-12-12T16:55:20.436624,20251212_165520,3,Will West Bromwich Albion FC win on 2025-12-12?,NO,3 out of 5 models agreed (2 NO_TRADE),3,-13.0%,47.0%,60.0%,"Sheffield United's superior current form (4 wins in last 5) outweighs West Brom's home advantage, making the 60% market price an overvaluation of WBA's chances.",https://polymarket.com/event/elc-wba-she-2025-12-12
2025-12-12T16:55:20.436624,20251212_165520,4,"Will Trump establish a Gaza ""Board of Peace"" in 2025? (Alternative perspective)",NO,5 out of 5 models see significant mispricing,5,-29.8% (strongest edge across all markets),71.25%,96.0%,"Unanimous agreement that 96% vastly overestimates probability given execution risk, political hurdles, and timeline constraints with year-end approaching.",https://polymarket.com/event/will-trump-establish-a-gaza-board-of-peace-in-2025
2025-12-12T16:55:20.436624,20251212_165520,5,Barcelona vs. Olympiacos B.C. (Confirmation),YES,4 out of 5 models see positive value,4,+11.3%,64.3%,54.3%,"Strong consensus on Barcelona's momentum and home advantage being underpriced, with only one model suggesting fair value at current odds.",https://polymarket.com/event/euroleague-barcelon-olympiac-2025-12-12
2025-12-12T17:01:14.954168,20251212_170114,1,Will West Bromwich Albion FC win on 2025-12-12?,NO,5 out of 5 models agreed,5,-21.0%,40.6%,60.0%,Sheffield United's 6-match unbeaten streak against West Brom's inconsistent form (2W-1D-2L) makes the 60% home win price significantly overvalued despite home advantage.,https://polymarket.com/event/elc-wba-she-2025-12-12
2025-12-12T17:01:14.954168,20251212_170114,2,Barcelona vs. Olympiacos B.C.,YES,4 out of 4 models agreed (1 no response),4,+13.3%,67.8%,54.3%,"Barcelona's exceptional form (7 wins in 8 games, 4-game winning streak) under new coach Xavi Pascual at home creates significant undervaluation at 54.3%.",https://polymarket.com/event/euroleague-barcelon-olympiac-2025-12-12
2025-12-12T17:01:14.954168,20251212_170114,3,"Will Trump establish a Gaza ""Board of Peace"" in 2025?",NO_TRADE (but leaning YES if forced),"3 out of 4 models chose NO_TRADE, 1 chose YES",3,-3.0%,93.0%,96.0%,"While establishment is highly likely given UN mandate and Trump's announcement, the 96% market price leaves minimal edge despite high conviction, with potential execution risks slightly underpriced.",https://polymarket.com/event/will-trump-establish-a-gaza-board-of-peace-in-2025
2025-12-12T17:07:07.984195,20251212_170707,1,"Will Trump establish a Gaza ""Board of Peace"" in 2025?",NO,4 out of 6 models agreed on NO,4,-39.8%,54.2%,96.0%,"Market severely overpriced at 96% when Trump explicitly stated members will be named ""early next year"" (2026), meaning establishment likely won't occur in 2025 despite announcements.",https://polymarket.com/event/will-trump-establish-a-gaza-board-of-peace-in-2025
2025-12-12T17:07:07.984195,20251212_170707,2,Will West Bromwich Albion FC win on 2025-12-12?,NO,5 out of 6 models agreed on NO (1 NO_TRADE),5,-21.7%,41.7%,60.0%,"West Brom's terrible form (2 wins in 10 matches, 16th place) against Sheffield United's 6-match unbeaten streak makes 60% market price significantly overvalued.",https://polymarket.com/event/elc-wba-she-2025-12-12
2025-12-12T17:07:07.984195,20251212_170707,3,Barcelona vs. Olympiacos B.C.,YES,4 out of 6 models agreed on YES (2 NO_TRADE),4,+12.5%,66.7%,54.3%,Barcelona's dramatic turnaround under new coach Xavi Pascual (7 wins in 8 games) plus home court advantage creates strong value against market's 54.3% pricing.,https://polymarket.com/event/euroleague-barcelon-olympiac-2025-12-12
2025-12-12T17:12:58.115037,20251212_171258,1,"Will Trump establish a Gaza ""Board of Peace"" in 2025?",NO,5 out of 5 models agreed,5,-49.8%,43.8%,96.0%,"News explicitly states the board will be unveiled in ""early 2026"" not 2025, creating massive mispricing as market confuses announcement with actual establishment.",https://polymarket.com/event/will-trump-establish-a-gaza-board-of-peace-in-2025
2025-12-12T17:12:58.115037,20251212_171258,2,Barcelona vs. Olympiacos B.C.,YES,5 out of 5 models agreed,5,+13.5%,67.8%,54.3%,Barcelona's 7-1 recent record under new coach with home court advantage is significantly undervalued against Olympiacos' mid-season roster changes.,https://polymarket.com/event/euroleague-barcelon-olympiac-2025-12-12
2025-12-12T17:12:58.115037,20251212_171258,3,Will West Bromwich Albion FC win on 2025-12-12?,NO,4 out of 5 models agreed (1 NO_TRADE),4,-13.0%,47.0%,60.0%,Sheffield United's 6-game unbeaten streak and even head-to-head history makes this closer to 50-50 than the 60% market price suggests for West Brom home win.,https://polymarket.com/event/elc-wba-she-2025-12-12
2025-12-12T17:18:52.126217,20251212_171852,1,Will West Bromwich Albion FC win on 2025-12-12?,NO,"4 out of 5 models agreed (OpenAI NO_TRADE, others NO)",4,-18%,42%,60.0%,Sheffield United's 6-match unbeaten streak under Wilder creates strong momentum that market significantly undervalues against West Brom's inconsistent form.,https://polymarket.com/event/elc-wba-she-2025-12-12
2025-12-12T17:18:52.126217,20251212_171852,2,Barcelona vs. Olympiacos B.C.,YES,3 out of 5 models agreed (2 NO_TRADE),3,+10.1%,64.3%,54.3%,Barcelona's 7 wins in last 8 games under new coach Xavi Pascual combined with home court advantage is undervalued by market pricing.,https://polymarket.com/event/euroleague-barcelon-olympiac-2025-12-12
2025-12-12T17:18:52.126217,20251212_171852,3,"Will Trump establish a Gaza ""Board of Peace"" in 2025?",NO,2 out of 5 models agreed on NO (3 NO_TRADE),2,-10.5%,85.5%,96.0%,"Trump only announced plans to name members ""early next year"" (potentially 2026), not formal establishment in 2025, creating significant execution risk the market underprices.",https://polymarket.com/event/will-trump-establish-a-gaza-board-of-peace-in-2025
2025-12-12T17:18:52.126217,20251212_171852,4,Will West Bromwich Albion FC win on 2025-12-12? (Alternative view),NO_TRADE,"Mixed signals (4 NO, 1 NO_TRADE)",0,-10% (OpenAI perspective),50%,60.0%,Conservative view suggests edge may be insufficient despite Sheffield's form advantage.,https://polymarket.com/event/elc-wba-she-2025-12-12
2025-12-12T17:18:52.126217,20251212_171852,5,"Will Trump establish a Gaza ""Board of Peace"" in 2025? (Conservative view)",NO_TRADE,3 out of 5 models chose NO_TRADE,3,-6% (among NO_TRADE models),89%,96.0%,"While announcement exists, bureaucratic delays and timing ambiguity create uncertainty that may not justify trade despite apparent mispricing.",https://polymarket.com/event/will-trump-establish-a-gaza-board-of-peace-in-2025
2025-12-12T17:24:43.991443,20251212_172443,1,"Will Trump establish a Gaza ""Board of Peace"" in 2025?",NO,"3 out of 5 models agreed (OpenAI NO_TRADE but leaning NO, DeepSeek NO, Claude NO)",3,-34.3%,61.7%,96.0%,"Trump explicitly stated members will be announced ""early next year"" (2026), meaning the board won't be fully established in 2025, making the 96% market price a massive overvaluation of a calendar year resolution issue.",https://polymarket.com/event/will-trump-establish-a-gaza-board-of-peace-in-2025
2025-12-12T17:24:43.991443,20251212_172443,2,Barcelona vs. Olympiacos B.C.,YES,"4 out of 4 models agreed (OpenAI YES, DeepSeek YES, Opus YES, Claude YES)",4,+13.8%,68.3%,54.3%,Barcelona's exceptional form under new coach Xavi Pascual (7 wins in 8 games) combined with home court advantage creates significant edge over the market price.,https://polymarket.com/event/euroleague-barcelon-olympiac-2025-12-12
2025-12-12T17:24:43.991443,20251212_172443,3,Will West Bromwich Albion FC win on 2025-12-12?,NO,"4 out of 5 models agreed (OpenAI NO, DeepSeek NO_TRADE but leaning NO, Opus NO, Gemini NO, Claude NO_TRADE)",4,-15.0%,47.5%,60.0%,"Sheffield United's impressive six-game unbeaten streak significantly outweighs West Brom's mixed form, making the 60% home win probability overpriced despite home advantage.",https://polymarket.com/event/elc-wba-she-2025-12-12
2025-12-12T17:30:38.391136,20251212_173038,1,"Will Trump establish a Gaza ""Board of Peace"" in 2025?",NO,4 out of 6 models agreed on NO,4,-26.0%,74.6%,96.0%,"Trump announced plans to name members ""early next year"" (2026), not establish the board in 2025, with only 19 days remaining and the market massively overpricing certainty of 2025 establishment.",https://polymarket.com/event/will-trump-establish-a-gaza-board-of-peace-in-2025
2025-12-12T17:30:38.391136,20251212_173038,2,Barcelona vs. Olympiacos B.C.,YES,5 out of 6 models agreed on YES,5,+12.2%,66.6%,54.3%,"Barcelona's exceptional home form (7 wins in 8 games, 4-game winning streak under new coach) creates significant value against the market's underpricing of their momentum.",https://polymarket.com/event/euroleague-barcelon-olympiac-2025-12-12
2025-12-12T17:30:38.391136,20251212_173038,3,Will West Bromwich Albion FC win on 2025-12-12?,NO,"2 out of 6 models agreed on NO (3 NO_TRADE, 2 YES)",2,-5.2%,54.8%,60.0%,"Despite Sheffield United's poor away form, West Brom's mixed recent results and bookmaker odds suggesting only 39% win probability indicate the market overvalues their home advantage.",https://polymarket.com/event/elc-wba-she-2025-12-12
2025-12-12T17:30:38.391136,20251212_173038,4,Will West Bromwich Albion FC win on 2025-12-12? (Alternative YES side),YES,2 out of 6 models agreed on YES,2,+7.5% (for YES voters only),67.5% (YES voters only),60.0%,Home advantage combined with Sheffield United's disastrous away record (6 losses in 8 games) suggests West Brom has better odds than market pricing reflects.,https://polymarket.com/event/elc-wba-she-2025-12-12
2025-12-12T17:30:38.391136,20251212_173038,5,"Will Trump establish a Gaza ""Board of Peace"" in 2025? (Alternative perspective)",NO_TRADE (but leaning YES for contrarians),"1 out of 6 models on YES, 1 NO_TRADE",1,+1.5% (for YES perspective),96.5%,96.0%,"While most models see NO value, the announcement and active implementation suggest near-certainty, though insufficient edge exists for either side to trade confidently.",https://polymarket.com/event/will-trump-establish-a-gaza-board-of-peace-in-2025
2025-12-12T17:36:33.393006,20251212_173633,1,"Will Trump establish a Gaza ""Board of Peace"" in 2025?",NO,"3 out of 5 models agreed (OpenAI NO_TRADE, DeepSeek NO_TRADE, Gemini NO, Opus NO_TRADE, Claude NO)",3,-46.8%,47.5%,96.0%,"Trump explicitly stated members would be announced ""early next year"" (2026), and establishing an international governance board requires months of implementation that cannot be completed in the remaining 19 days of 2025.",https://polymarket.com/event/will-trump-establish-a-gaza-board-of-peace-in-2025
2025-12-12T17:36:33.393006,20251212_173633,2,Will West Bromwich Albion FC win on 2025-12-12?,NO,5 out of 5 models agreed (all recommend NO or NO_TRADE favoring NO),5,-26.0%,34.0%,60.0%,"West Brom's dismal form (2 wins in last 10 matches, 16th place) against Sheffield United's 6-game unbeaten streak and dominant head-to-head record makes the 60% market price severely overvalued.",https://polymarket.com/event/elc-wba-she-2025-12-12
