timestamp,run_id,rank,market_title,side,consensus,consensus_count,average_edge,ai_probability,market_price,reasoning,link
2025-12-12T22:38:33.304916,20251212_223833,2,Will SC Freiburg win on 2025-12-14?,NO,"2 out of 5 models agreed on NO (Claude YES at 42%, DeepSeek NO at 15%)",2,+3.4% (mixed directional signals),27.8%,28.0%,"DeepSeek identifies significant overvaluation at -13% edge citing Dortmund's strong away form and historical dominance, while Claude sees +14% edge for YES based on home advantage—creating a split opportunity favoring NO given Dortmund's quality.",https://polymarket.com/event/bun-fre-dor-2025-12-14
2025-12-12T22:38:33.304916,20251212_223833,3,Spread: Bulls (-2.5),NO,"3 out of 5 models agreed (OpenAI, Claude, DeepSeek leaning NO/skeptical)",3,-6.7%,42.0%,52.0%,Bulls' catastrophic 7-game losing streak and key injuries make the 52% market price an overvaluation of their ability to cover a -2.5 spread on the road against a struggling but relatively better Hornets team.,https://polymarket.com/event/nba-chi-cha-2025-12-12
2025-12-12T22:38:33.304916,20251212_223833,4,Will SC Freiburg win on 2025-12-14? (Alternative view),YES,1 strong model (Claude at +14% edge),0,+14.0% (Claude only),42.0%,28.0%,"Claude identifies that 28% severely undervalues Freiburg's home advantage and recent Europa League form, as Bundesliga home teams typically win ~43% of matches.",https://polymarket.com/event/bun-fre-dor-2025-12-14
2025-12-12T22:38:33.304916,20251212_223833,5,Will there be at least 2100 measles cases in the U.S. in 2025? (Conservative view),NO_TRADE,1 model (Claude) suggests caution,0,+3.0%,65.0%,62.0%,"Claude's conservative analysis suggests the market at 62% already prices in outbreak momentum reasonably well, though most other models see stronger edge for YES.",https://polymarket.com/event/measles-cases-in-us-before-2026
2025-12-12T22:44:28.786404,20251212_224428,1,Will the Fed Cut–Cut–Cut in the next three decisions (Dec–Jan–Mar)?,NO,5 out of 5 models agreed,5,-38.0%,54.0%,92.5%,Market severely overprices consecutive cuts at 92.5% when January cut probability is only 21.8% and FOMC dissent signals inflation concerns make three consecutive cuts highly unlikely.,https://polymarket.com/event/next-three-fed-decisions-847
2025-12-12T22:44:28.786404,20251212_224428,2,Pacers vs. 76ers: O/U 229.5,YES (UNDER),4 out of 5 models agreed on UNDER,4,+3.6%,71.6%,70.0%,"Strong trend data shows Pacers hit under in 9 of last 11 road games and 76ers in 4 consecutive games, yet market only prices UNDER at 70% when probability appears closer to 80-85%.",https://polymarket.com/event/nba-ind-phi-2025-12-12
2025-12-12T22:44:28.786404,20251212_224428,3,Lions vs. Rams,NO (bet Rams),4 out of 5 models leaned toward Rams (NO on Lions),4,-10.7%,60.0%,70.9%,"Market overvalues Lions at 70.9% despite Rams having superior 10-3 record, home field advantage at SoFi, and Lions losing starting safety Brian Branch to season-ending injury.",https://polymarket.com/event/nfl-det-la-2025-12-14
2025-12-12T22:44:28.786404,20251212_224428,4,Will the Fed Cut–Cut–Cut in the next three decisions (Dec–Jan–Mar)?,NO,5 out of 5 models agreed (DUPLICATE - STRONGEST EDGE),5,-38.0%,54.0%,92.5%,Mathematical probability of three consecutive cuts is dramatically lower than 92.5% given January cut is priced at only 21.8% in futures markets.,https://polymarket.com/event/next-three-fed-decisions-847
2025-12-12T22:44:28.786404,20251212_224428,5,Pacers vs. 76ers: O/U 229.5,YES (UNDER),4 out of 5 models agreed (DUPLICATE - SECOND STRONGEST),4,+3.6%,71.6%,70.0%,"Expert consensus and recent performance trends heavily favor under, with both teams showing defensive improvements and consistent under results.",https://polymarket.com/event/nba-ind-phi-2025-12-12
2025-12-12T22:50:28.438586,20251212_225028,1,Cavaliers vs. Wizards: O/U 245.5,NO (bet UNDER),3 out of 4 models agreed on NO,3,-10.0%,40%,50.0%,"Cavaliers scored season-low 94 points recently and lost 5 of 7 with offensive struggles, while Wizards are league-worst, making 245.5 an excessively high total for this matchup.",https://polymarket.com/event/nba-cle-was-2025-12-12
2025-12-12T22:50:28.438586,20251212_225028,2,Texas Longhorns vs. Connecticut Huskies,NO (bet UConn),3 out of 4 models agreed on NO,3,-9.0%,81%,90.0%,"While UConn is correctly favored as #5 ranked team at home on 5-game win streak, the 90% market price slightly overestimates their dominance against an unranked but competent Texas team.",https://polymarket.com/event/cbb-tx-uconn-2025-12-12
2025-12-12T22:50:28.438586,20251212_225028,3,Will Sydney FC win on 2025-12-13?,YES,2 out of 4 models agreed on YES (2 NO_TRADE),2,+7.2%,56%,48.7%,"Sydney FC leads the league with 5 wins in last 6 matches, and despite Perth's home advantage, the market undervalues the league leader's superior form and quality.",https://polymarket.com/event/aus-per-syd-2025-12-13
2025-12-12T22:50:28.438586,20251212_225028,4,Will Sydney FC win on 2025-12-13?,NO_TRADE,4 out of 4 models acknowledged edge exists but divided on action,4,+7.2%,56%,48.7%,All models recognize Sydney's quality advantage but Perth's 3-game home win streak and venue advantage create enough uncertainty to warrant caution despite positive edge.,https://polymarket.com/event/aus-per-syd-2025-12-13
2025-12-12T22:50:28.438586,20251212_225028,5,Cavaliers vs. Wizards: O/U 245.5,NO_TRADE (per OpenAI),1 out of 4 models suggested NO_TRADE,1,0% (this model only),50%,50.0%,"Minority view suggesting uncertainty balances out, though this contradicts the stronger consensus for UNDER based on Cleveland's recent offensive struggles.",https://polymarket.com/event/nba-cle-was-2025-12-12
2025-12-12T22:56:21.625070,20251212_225621,1,"Will ""Avatar: Fire and Ash"" Opening Weekend Box Office be between 101m and 112m?",YES,4 out of 4 models agreed (100%),4,+18.5%,35.5%,17.0%,"Industry projections center around $110M placing this range directly in the middle of the distribution, while the market significantly underprices this well-positioned window at only 17%.",https://polymarket.com/event/avatar-fire-and-ash-opening-weekend-box-office
2025-12-12T22:56:21.625070,20251212_225621,2,Counter-Strike: FaZe vs Natus Vincere (BO3),NO (bet on NAVI),3 out of 4 models agreed (75%),3,+16.6%,44%,60.8%,"NAVI's recent 2-0 dominant victory over FaZe at IEM Cologne 2025 with MVP performance demonstrates clear superiority, yet the market overvalues FaZe at 60.8%.",https://polymarket.com/event/cs2-faze-navi-2025-12-13
2025-12-12T22:56:21.625070,20251212_225621,3,Games Total: O/U 3.5,NO_TRADE,4 out of 5 models agreed on NO_TRADE/neutral (80%),4,+6.4%,53.4%,50.0%,Insufficient specific context about the Call of Duty teams' recent performance and playstyle makes this market fairly priced with no actionable edge despite one outlier prediction.,https://polymarket.com/event/codmw-van-tor-2025-12-12
2025-12-12T23:02:30.980244,20251212_230230,1,NATO downs another Russian drone by December 31?,NO,"5 out of 6 models agreed (OpenAI, DeepSeek, Claude, Opus, Groq)",5,-18.0%,72%,96.0%,"No reported NATO drone shootdowns in over 3 months since September 10, yet market prices 96% probability for occurrence in remaining 19 days—clear overpricing of recency.",https://polymarket.com/event/nato-downs-another-russian-drone-by-september-30
2025-12-12T23:02:30.980244,20251212_230230,2,Spread: Cavaliers (-15.5),YES,"4 out of 6 models agreed (DeepSeek, Gemini, Claude, Groq)",4,+10.7%,60.5%,49.4%,Cavaliers getting key defender Allen back after 5-day rest against historically bad 3-19 Wizards on losing streak creates significant value against the spread.,https://polymarket.com/event/nba-cle-was-2025-12-12
2025-12-12T23:02:30.980244,20251212_230230,3,"Will Anthropic not IPO by June 30, 2026?",YES,"2 out of 6 models agreed (Gemini, Opus)",2,+8.3%,66.7%,60.0%,"Despite IPO preparations, Anthropic's explicit statement of ""no immediate plans"" combined with only 6.5 months remaining suggests market underprices probability of no IPO.",https://polymarket.com/event/anthropic-ipo-closing-market-cap
2025-12-12T23:02:30.980244,20251212_230230,4,"Will Anthropic not IPO by June 30, 2026?",NO_TRADE,"4 out of 6 models agreed (OpenAI, DeepSeek, Claude, Groq)",4,+2.5%,62.5%,60.0%,"Market fairly prices the uncertainty between IPO preparations and lack of immediate timeline, offering insufficient edge for confident trade.",https://polymarket.com/event/anthropic-ipo-closing-market-cap
2025-12-12T23:02:30.980244,20251212_230230,5,Spread: Cavaliers (-15.5),NO_TRADE,"2 out of 6 models agreed (OpenAI, Opus)",2,+1.3%,51%,49.4%,"Despite Cavaliers being superior team, their recent 5-7 stretch and massive 15.5-point spread creates near coin-flip probability that market accurately reflects.",https://polymarket.com/event/nba-cle-was-2025-12-12
2025-12-12T23:08:30.808084,20251212_230830,1,Will FC Metz vs. Paris Saint-Germain FC end in a draw?,NO,5 out of 5 models agreed (100%),5,-73.6%,10.4%,85.0%,"PSG has won all 13 historical meetings with zero draws, and with PSG 2nd in league versus Metz 18th and struggling defensively, a draw is extremely unlikely making the NO side at 15% implied price highly valuable.",https://polymarket.com/event/fl1-met-psg-2025-12-13
2025-12-12T23:08:30.808084,20251212_230830,2,Will Luís Marques Mendes win the 2026 Portugal presidential election?,NO,2 out of 5 models agreed on NO (3 NO_TRADE),2,-13.1%,61.3%,72.8%,Admiral Gouveia e Melo's independent candidacy with strong polling momentum presents significant competition that the 72.8% market price doesn't fully account for in this competitive multi-candidate race.,https://polymarket.com/event/portugal-presidential-election
2025-12-12T23:08:30.808084,20251212_230830,3,Spread: Pistons (-5.5),YES,"2 out of 5 models agreed on YES (2 NO_TRADE, 1 mixed)",2,+7.8%,63.8%,56.0%,The Pistons' dominant 19-5 record (best in East) with strong home form against an inconsistent 14-11 Hawks team suggests the market is undervaluing Detroit's ability to cover a modest 5.5-point spread.,https://polymarket.com/event/nba-atl-det-2025-12-12
2025-12-12T23:14:36.072903,20251212_231436,1,Will SC Paderborn 07 win on 2025-12-13?,YES,4 out of 4 models agreed (100%),4,+15.5%,59.5%,44.0%,Karlsruher SC's 3-game losing streak and Paderborn's strong recent form (2-0 vs Schalke) creates significant value with multiple prediction models converging at ~60% win probability.,https://polymarket.com/event/bl2-ksc-scp-2025-12-13
2025-12-12T23:14:36.072903,20251212_231436,2,Jazz vs. Grizzlies: O/U 242.5,YES (Over),3 out of 4 models agreed (75%),3,+9.3%,62.3%,53.0%,"Grizzlies' 58% over rate this season (42/72 games), Ja Morant's potential return adding offensive firepower, and Jazz defensive struggles point to high-scoring game significantly underpriced by market.",https://polymarket.com/event/nba-uta-mem-2025-12-12
2025-12-12T23:14:36.072903,20251212_231436,3,Games Total: O/U 3.5,NO_TRADE,5 out of 5 models agreed (100%),5,-2.5%,65.8%,71.0%,"Market fairly priced for LoL best-of-5 between top Korean teams with historical 65-70% probability for over 3.5 games, insufficient edge for trade despite perfect consensus.",https://polymarket.com/event/lol-dk-t1-2025-12-13
2025-12-12T23:20:34.524851,20251212_232034,1,Will Azerbaijan join the Abraham Accords in 2025?,NO,5 out of 5 models agreed (100%),5,-35.3%,61.4%,96.7%,Market wildly overprices certainty at 96.7% when Azerbaijan has not officially joined as of Dec 12 with only ~19 days remaining and unresolved Armenia peace process as precondition.,https://polymarket.com/event/which-country-will-join-abraham-accords-in-2025
2025-12-12T23:20:34.524851,20251212_232034,2,Spread: Bulls (-3.5),NO,5 out of 5 models agreed (100%),5,-13.4%,40.4%,55.0%,"Bulls on catastrophic 7-game losing streak including 32-point blowout loss, yet market still prices them as 55% likely to cover -3.5 spread against Hornets at home.",https://polymarket.com/event/nba-chi-cha-2025-12-12
2025-12-12T23:20:34.524851,20251212_232034,3,Spurs vs. Thunder: O/U 225.5,SPLIT (3 models favor different sides),"3 out of 5 models provided actionable opinions (2 YES, 1 NO)",3,+9.7% (for those with positions),60.0% (for those with positions),50.0%,"Market at perfect 50/50 creates opportunity as models see clear directional edge, though split between Over (high-stakes semifinal pace) and Under (Thunder elite defense).",https://polymarket.com/event/nba-sas-okc-2025-12-13
2025-12-12T23:20:34.524851,20251212_232034,4,Will Azerbaijan join the Abraham Accords in 2025? (NO_TRADE consideration),NO_TRADE,1 out of 5 models recommended no trade,1,-4.7% (Claude's assessment),92%,96.7%,"Conservative view suggests edge insufficient despite mispricing, though majority of models see significant betting value on NO side.",https://polymarket.com/event/which-country-will-join-abraham-accords-in-2025
2025-12-12T23:20:34.524851,20251212_232034,5,Spurs vs. Thunder: O/U 225.5 (NO_TRADE consideration),NO_TRADE,1 out of 5 models recommended no trade,1,+5% (OpenAI's assessment),55%,50.0%,"Modest edge deemed insufficient for trade by one model, though other models see actionable value on both sides of this tight matchup.",https://polymarket.com/event/nba-sas-okc-2025-12-13
2025-12-12T23:26:33.888367,20251212_232633,1,China x Japan military clash before 2027?,NO,4 out of 4 models agreed,4,-42.0%,43.0%,85.0%,Market severely overreacts to recent radar incidents when historical precedent shows dozens of similar provocations between major powers never escalate to actual military clashes due to economic interdependence and diplomatic channels.,https://polymarket.com/event/china-x-japan-military-clash-before-2027
2025-12-12T23:26:33.888367,20251212_232633,2,Israel x Iran ceasefire broken by December 31?,NO,4 out of 4 models agreed,4,-40.2%,57.5%,97.7%,"Ceasefire has demonstrably held for 6 months with only isolated accusations, yet market prices 97.7% probability of breakdown in just 19 remaining days—a dramatic overreaction to past tensions versus current stability.",https://polymarket.com/event/israel-x-iran-ceasefire-broken-by
2025-12-12T23:26:33.888367,20251212_232633,3,Jazz vs. Grizzlies: O/U 234.5,NO_TRADE,5 out of 5 models agreed,5,-4.2%,67.6%,72.7%,"Injury uncertainty (Edey out, Morant questionable) creates conflicting pace/scoring dynamics with insufficient edge to justify position despite slight lean toward under.",https://polymarket.com/event/nba-uta-mem-2025-12-12
2025-12-12T23:32:28.914250,20251212_233228,1,Over $400M committed to the Gensyn public sale?,NO,"3 out of 4 models agreed (OpenAI NO_TRADE, DeepSeek NO, Opus NO, Claude NO)",3,-21.2%,66.7%,83.2%,Market fundamentally misunderstands token sale mechanics - only 300M tokens (3% supply) available with FDV range $100M-$1B makes $400M in commitments mathematically improbable.,https://polymarket.com/event/gensyn-public-sale-total-commitments
2025-12-12T23:32:28.914250,20251212_233228,2,Will Preston North End FC win on 2025-12-13?,YES,"3 out of 4 models agreed (OpenAI YES, DeepSeek YES, Claude YES, Opus NO_TRADE)",3,+13.1%,49.3%,34.9%,"Oxford United's poor form (1 win in last 5 games) is significantly underpriced, with Preston's competitive away performance suggesting market undervalues their win probability by ~13%.",https://polymarket.com/event/elc-oxf-pne-2025-12-13
2025-12-12T23:32:28.914250,20251212_233228,3,Pacers vs. 76ers: O/U 221.5,NO (Under),"3 out of 5 models agreed on NO (OpenAI NO, Gemini NO, Claude NO_TRADE, DeepSeek NO_TRADE, Opus NO_TRADE)",3,-8.0%,42.4%,48.0%,Strong defensive metrics (both teams 6th/7th in defensive rating) and Pacers hitting under in 15/24 games (especially 9/11 road games) suggest market overvalues the over at 48%.,https://polymarket.com/event/nba-ind-phi-2025-12-12
2025-12-12T23:32:28.914250,20251212_233228,4,Pacers vs. 76ers: O/U 221.5 (Alternative perspective),NO_TRADE (but leaning Under),5 out of 5 models analyzed this market with majority favoring Under,5,-8.0%,42.4%,48.0%,"While edge exists, most sophisticated models (Opus, Claude, DeepSeek) note it falls below 10% threshold for confident trading despite strong defensive trends.",https://polymarket.com/event/nba-ind-phi-2025-12-12
2025-12-12T23:32:28.914250,20251212_233228,5,Will Preston North End FC win on 2025-12-13? (Risk assessment),YES (with caution),3 out of 4 models agreed,3,+13.1%,49.3%,34.9%,"Despite strong consensus, this is an away match with traditional betting odds suggesting closer to 30-33% probability, making the 13% edge potentially overstated but still actionable.",https://polymarket.com/event/elc-oxf-pne-2025-12-13
2025-12-12T23:38:24.774846,20251212_233824,1,"Will Trump say ""Terrible"" or ""Horrible"" 4+ times during Bill Signing on December 12?",NO_TRADE,5 out of 5 models agreed on NO_TRADE or NO,5,-31.1%,66%,97.6%,"Strong consensus that market is overpriced at 97.6%, with most models estimating 50-95% probability, though event may have already occurred making this untradeable.",https://polymarket.com/event/what-will-trump-say-during-bill-signing-on-december-12
2025-12-12T23:38:24.774846,20251212_233824,2,Titans vs. 49ers,NO_TRADE (with slight NO lean from 2 models),"3 out of 5 models pure NO_TRADE, 2 suggested NO",3,-4.5%,83.2%,88.0%,"Market slightly overprices 49ers dominance, but consensus is edge insufficient for trade despite Titans' recent offensive improvement.",https://polymarket.com/event/nfl-ten-sf-2025-12-14
2025-12-12T23:38:24.774846,20251212_233824,3,Browns vs. Bears,NO_TRADE (with slight NO lean from 2 models),"3 out of 5 models pure NO_TRADE, 2 suggested NO",3,-2.8%,74.2%,77.0%,"Market slightly overprices Bears at 77%, with rookie QB Sanders providing upset potential, but edge remains below actionable threshold.",https://polymarket.com/event/nfl-cle-chi-2025-12-14
2025-12-12T23:44:14.484602,20251212_234414,1,Fogo FDV above $2B one day after launch?,NO,3 out of 4 models agreed on NO,3,-59.3%,38.3%,94.5%,"Market shows extreme overconfidence (94.5%) on a crypto token launch with zero public information available, creating massive edge on NO side.",https://polymarket.com/event/fogo-fdv-above-one-day-after-launch
2025-12-12T23:44:14.484602,20251212_234414,2,Khamenei out as Supreme Leader of Iran by June 30?,NO,3 out of 4 models agreed on NO (with varying interpretations),3,-40.6%,24.5%,80.3%,"Despite recent geopolitical tensions, forcibly removing an entrenched Supreme Leader within 6 months remains extremely unlikely, yet market prices it at 80.3%.",https://polymarket.com/event/khamenei-out-as-supreme-leader-of-iran-by-june-30-747
2025-12-12T23:44:14.484602,20251212_234414,3,Browns vs. Bears,NO_TRADE,3 out of 4 models agreed on NO_TRADE,3,-1.3%,75.8%,77.0%,"Market is fairly priced with Bears as 7.5-point favorites, offering minimal edge despite Browns' poor record.",https://polymarket.com/event/nfl-cle-chi-2025-12-14
2025-12-12T23:50:07.876618,20251212_235007,1,Meta releases Llama 5 in 2025?,NO,"3 out of 5 models agreed (OpenAI, DeepSeek, Gemini voted NO; Claude/Opus said NO_TRADE)",3,-47.5%,38.4%,96.3%,"News confirms Llama 5 has NOT been released as of Dec 12, 2025, with Meta's next model ""Avocado"" targeting Q1 2026, making a release in the remaining 19 days extremely unlikely despite the 96.3% YES price.",https://polymarket.com/event/meta-release-llama-5-in-2025
2025-12-12T23:50:07.876618,20251212_235007,2,Will Rayo Vallecano de Madrid vs. Real Betis Balompié end in a draw?,YES,"4 out of 5 models agreed (OpenAI, DeepSeek, Opus, Claude all voted YES)",4,+14.8%,38.8%,24.0%,"Multiple expert sources (BetClan 37%, Forebet 48%, Betfair odds implying ~29%) predict significantly higher draw probability than the 24% market price for this evenly-matched La Liga fixture.",https://polymarket.com/event/lal-ray-bet-2025-12-15
2025-12-12T23:50:07.876618,20251212_235007,3,Sharks vs. Penguins,YES,2 out of 5 models agreed (Opus and Claude voted YES; OpenAI/DeepSeek said NO_TRADE),2,+9.3%,49.3%,40.0%,"Sharks have strong recent momentum with back-to-back wins after breaking an 8-game losing streak, while Penguins are inconsistent (4-3-3 last 10), suggesting the 40% market price undervalues San Jose's improved form.",https://polymarket.com/event/nhl-sj-pit-2025-12-13
2025-12-12T23:50:07.876618,20251212_235007,4,Sharks vs. Penguins (NO_TRADE perspective),NO_TRADE,2 out of 5 models agreed (OpenAI and DeepSeek),2,+5.0%,45.0%,40.0%,"While Sharks show improvement, the edge is marginal at only 5%, falling below the typical 10% threshold for confident trading despite recent momentum.",https://polymarket.com/event/nhl-sj-pit-2025-12-13
2025-12-12T23:50:07.876618,20251212_235007,5,Meta releases Llama 5 in 2025? (NO_TRADE perspective),NO_TRADE,2 out of 5 models agreed (Opus and Claude),2,-2.8%,93.5%,96.3%,"While the NO outcome is highly likely, the market is already efficiently priced at 96.3%, leaving insufficient edge (only 3.7% NO price) to justify the trade despite strong conviction.",https://polymarket.com/event/meta-release-llama-5-in-2025
2025-12-12T23:56:03.122152,20251212_235603,1,Meta releases Llama 5 in 2025?,NO,4 out of 5 models agreed (Claude = NO_TRADE but acknowledged NO is correct),4,-88.8%,7.2%,96.3%,"With only 19 days left in 2025 and explicit confirmation Meta hasn't released Llama 5 as of Dec 12, the market is severely overpricing YES at 96.3% when probability is near 0%.",https://polymarket.com/event/meta-release-llama-5-in-2025
2025-12-12T23:56:03.122152,20251212_235603,2,Will Rayo Vallecano de Madrid vs. Real Betis Balompié end in a draw?,YES,4 out of 4 models agreed (Groq had no response),4,+16.7%,40.7%,24.0%,"Multiple prediction algorithms (BetClan 37%, Forebet 48%) and recent 2-2 head-to-head result indicate market is significantly undervaluing draw probability by ~17%.",https://polymarket.com/event/lal-ray-bet-2025-12-15
2025-12-12T23:56:03.122152,20251212_235603,3,Sharks vs. Penguins,NO_TRADE,5 out of 5 models agreed,5,-1.4%,38.2%,40.0%,Market is efficiently priced with minimal edge in either direction; Sharks momentum balanced against Penguins' home advantage and historical dominance creates fair odds.,https://polymarket.com/event/nhl-sj-pit-2025-12-13
2025-12-13T00:01:53.197468,20251213_000153,1,Will Aston Villa FC win on 2025-12-14?,YES,"4 out of 5 models agreed (GROQ excluded, OpenAI NO_TRADE but leaning YES)",4,+14.8%,65.8%,53.0%,"Aston Villa's 8-game winning streak and exceptional form under Emery is significantly undervalued by the market, with all models seeing 60%+ win probability against struggling West Ham.",https://polymarket.com/event/epl-wes-ast-2025-12-14
2025-12-13T00:01:53.197468,20251213_000153,2,Will Rayo Vallecano de Madrid vs. Real Betis Balompié end in a draw?,YES,5 out of 5 models agreed,5,+13.8%,37.8%,24.0%,"Real Betis missing three key players (Amrabat injured, Abde and Bakambu at AFCON) dramatically increases draw probability that the market has failed to price in adequately.",https://polymarket.com/event/lal-ray-bet-2025-12-15
2025-12-13T00:01:53.197468,20251213_000153,3,Sharks vs. Penguins,NO (Penguins to win),5 out of 5 models agreed on NO/NO_TRADE,5,-0.8%,39.4%,40.0%,"While consensus is strong against Sharks, the edge is minimal and most models recommend NO_TRADE due to Sharks playing back-to-back offsetting their momentum against Penguins getting Rakell back.",https://polymarket.com/event/nhl-sj-pit-2025-12-13
2025-12-13T00:07:45.580044,20251213_000745,1,Will Fartcoin hit $0.7 by December 31?,NO,4 out of 4 models agreed (100%),4,-82.3%,10.75%,93.0%,"Fartcoin needs to nearly double from $0.37 to $0.70 in just 18 days with no catalyst, while even bullish forecasts only predict $0.40 by year-end, making the 93% YES price severely mispriced.",https://polymarket.com/event/will-fartcoin-hit-0pt7-by-december-31
2025-12-13T00:07:45.580044,20251213_000745,2,Will Theo launch a token by December 31 2025?,NO,"3 out of 4 models agreed on NO (75%, 1 NO_TRADE)",3,-70.1%,4.25%,97.8%,"With zero public announcements or credible information about a token launch and only 18 days remaining, the market is correctly pricing this as extremely unlikely with minimal edge remaining.",https://polymarket.com/event/will-theo-launch-a-token-by
2025-12-13T00:07:45.580044,20251213_000745,3,Spread: Panthers (-2.5),YES,"1 out of 4 models agreed on YES (25%, 2 NO_TRADE, 1 NO)",1,+0.5%,52.5%,53.0%,"Only Claude identified significant edge (+12%) with Panthers getting Jaycee Horn back and being road favorites, but consensus is weak with mixed signals across models suggesting the market is fairly priced.",https://polymarket.com/event/nfl-car-no-2025-12-14
2025-12-13T00:13:40.587680,20251213_001340,1,Yoon out of custody by March 31?,NO,5 out of 5 models agreed (all favor NO side with probabilities far below market),5,-38.0%,45.6%,82.0%,Market severely overestimates release probability given Yoon's July 2025 re-arrest on serious charges with court citing evidence destruction concerns and only 3.5 months until deadline.,https://polymarket.com/event/yoon-out-of-custody-by-march-31
2025-12-13T00:13:40.587680,20251213_001340,2,Will Russia capture Rodynske by December 31?,NO,5 out of 5 models agreed (all favor NO side),5,-33.4%,37.5%,73.0%,"Ukrainian military confirms town remains under their control with only minimal Russian incursions on outskirts, making full capture in remaining 18 days highly unlikely.",https://polymarket.com/event/will-russia-capture-rodynske-by-september-15
2025-12-13T00:13:40.587680,20251213_001340,3,Counter-Strike: Alliance vs 9INE (BO3),YES (9INE to win),"2 out of 5 models agreed on YES, 3 said NO_TRADE (but all calculated positive edge for 9INE)",2,+15.4%,55.2%,43.8%,9INE's dominant 4-1 head-to-head record against Alliance and recent 2-0 playoff victory suggests market undervalues their chances despite Alliance's recent form.,https://polymarket.com/event/cs2-all-9ine-2025-12-13
